search_role,job_title,company_name,experience,location,skills,posted_date,job_link
Data Scientist,Data Scientist,PayU,0-3 yrs,Gurugram,"Usage, Statistical analysis, Analytical, Focus, Programming, Data mining, Business understanding, Analytics",3 days ago,https://www.naukri.com/job-listings-data-scientist-payu-india-gurugram-0-to-3-years-300326502718
Data Scientist,Data Scientist,Paytm,1-3 yrs,Gurugram,"data scientist, algorithms, python, scala, data processing, machine learning, cloud platform, cloud",2 days ago,https://www.naukri.com/job-listings-data-scientist-one97-communications-limited-gurugram-1-to-3-years-310326918257
Data Scientist,Data Scientist,Siemens,10-15 yrs,Bengaluru,"data scientist, time series analysis, snowflake, python, github, project management, ai, databricks",6 days ago,https://www.naukri.com/job-listings-data-scientist-siemens-limited-bengaluru-10-to-15-years-270326915025
Data Scientist,Data Scientist - Service Parts Supply Chain,Philips,10-15 yrs,Bengaluru,"Supply chain, Supply chain management, ERP, Performance management, Project management, Process improvement, Business analytics, Healthcare",1 day ago,https://www.naukri.com/job-listings-data-scientist-service-parts-supply-chain-philips-india-limited-bengaluru-10-to-15-years-020426508504
Data Scientist,Data Scientist,Narayana Health (NH),1-3 yrs,Hybrid - Bengaluru,"Tensorflow, Machine Learning, Python, Artificial Intelligence, Deep Learning, SQL, Machine, Intelligence",1 day ago,https://www.naukri.com/job-listings-data-scientist-narayana-health-nh-bengaluru-1-to-3-years-010426015191
Data Scientist,Data Scientist,Infosys,10-14 yrs,Bengaluru,"data scientist, analytics, data science, machine learning, financial services, communication skills, Data, Machine",2 days ago,https://www.naukri.com/job-listings-data-scientist-infosys-limited-bengaluru-10-to-14-years-310326930987
Data Scientist,Data Scientist-Artificial Intelligence,IBM,10-15 yrs,Gurugram,"data scientist, operations, b2b, semiconductor, fabrication, design, manufacturing, mes",1 day ago,https://www.naukri.com/job-listings-data-scientist-artificial-intelligence-ibm-india-pvt-limited-gurugram-10-to-15-years-020426929265
Data Analyst,Looking For immediate joiners - Lab Data Analyst-Python Programming,IQVIA,0-1 yrs,Hybrid - Bengaluru,"PYTHON PROGRAMMING, Pyspark, Logical Approach, Python Data Analytics, Python Data, PYTHON SCRIPTING, Numpy, Logic",1 day ago,https://www.naukri.com/job-listings-looking-for-immediate-joiners-lab-data-analyst-python-programming-iqvia-bengaluru-0-to-1-years-051125000118
Data Analyst,Data Analyst,Jindal Aluminium,0-2 yrs,Bengaluru,"Analytical skills, tableau, Excel, Database management, power bi, Data Analyst, Operations, Data warehousing",1 week ago,https://www.naukri.com/job-listings-data-analyst-jindal-aluminium-ltd-bengaluru-0-to-2-years-260326501248
Data Analyst,Data Analyst,MNC,0-2 yrs,"Pimpri-Chinchwad, Pune","Google Sheets, Power Bi, MS Office, SQL, Data Analytics, Large Databases, Google Data Studio, data vis",1 day ago,https://www.naukri.com/job-listings-data-analyst-tele-infotech-pimpri-chinchwad-pune-0-to-2-years-020426035841
Data Analyst,Data Analyst (Walk in Interview),Wyzmindz Solutions,0-1 yrs,Bengaluru,"Power Bi, Data Analytics, Bi Tools, Tableau, Bi, Interviewing, Data analysis, Analytics",6 days ago,https://www.naukri.com/job-listings-data-analyst-walk-in-interview-wyzmindz-solutions-bengaluru-0-to-1-years-270326011326
Data Analyst,Data Analyst,Great Place to Work,0-2 yrs,Hybrid - Mumbai(Lower Parel),"Power Bi, Data Analysis, Excel, Research Analysis, Data Visualization, Dashboards, Data Reporting, SQL",1 day ago,https://www.naukri.com/job-listings-data-analyst-great-place-to-work-mumbai-0-to-2-years-170326021042
Data Analyst,Data Analyst,Clustor Computing,0-2 yrs,Nagpur,"Analytical skills, Data analysis, Manager Quality Assurance, data science, power bi, Data analytics, data visualization, digital transformation",2 weeks ago,https://www.naukri.com/job-listings-data-analyst-cluster-computing-nagpur-0-to-2-years-190326505544
Data Analyst,Data Analyst,21K SchoolMindreflex Technologies,1-3 yrs,Bengaluru(Indira Nagar),"Power Bi, SQL, Data Management, Data Discrepency, Data Analysis, Tableau, Data Analytics, Governance",2 days ago,https://www.naukri.com/job-listings-data-analyst-21k-schoolmindreflex-technologies-bengaluru-1-to-3-years-010426011050
Data Analyst,Analyst/Data Analyst - Val Rsch,eClerx,0-2 yrs,Coimbatore,"linguistics, language teaching, data analysis, data analytics, analytical, data validation, verbal communication, problem solving",6 days ago,https://www.naukri.com/job-listings-analyst-data-analyst-val-rsch-eclerx-services-ltd-coimbatore-0-to-2-years-270326012951
Data Analyst,Data Analyst - Perch Energy,Arcadia,0-3 yrs,Chennai,"SQL queries, Data analysis, Excel, Analog, Billing, Data Analyst, Medical insurance, Troubleshooting",1 day ago,https://www.naukri.com/job-listings-data-analyst-perch-energy-arcadia-chennai-0-to-3-years-010426502808
Data Analyst,Data Analyst - Perch Energy,Arcadia,0-3 yrs,Chennai,"SQL queries, Data analysis, Excel, Analog, Billing, Data Analyst, Medical insurance, Troubleshooting",1 day ago,https://www.naukri.com/job-listings-data-analyst-perch-energy-arcadia-chennai-0-to-3-years-010426502810
Data Analyst,Data Analyst,Legistify,0-1 yrs,Gurugram,"metadata, python, data analysis, data management, data analytics, data validation, configuration, data mining",3+ weeks ago,https://www.naukri.com/job-listings-data-analyst-legistify-gurugram-0-to-1-years-221124503733
Data Analyst,Data & Backend Analyst,Backrock Studios,0-2 yrs,Bengaluru,"Backend, Senior Analyst, Gaming, Senior, Data",1 week ago,https://www.naukri.com/job-listings-data-backend-analyst-backrock-studios-bengaluru-0-to-2-years-230326505250
Data Analyst,Data Analyst,Ebizneeds (India) Internet Solutions Pvt. Ltd,0-3 yrs,Jaipur,"master data, metadata, python, data analysis, data management, data analytics, data validation, configuration",3+ weeks ago,https://www.naukri.com/job-listings-data-analyst-ebizneeds-india-internet-solutions-pvt-ltd-jaipur-0-to-3-years-140725501950
Data Analyst,Data Analyst,eAspire Technolabs Inc.,0-1 yrs,Gurugram,"Power Bi, Bi Tools, Tableau, Data, Tools, Data analysis, Bi",2 weeks ago,https://www.naukri.com/job-listings-data-analyst-evoke-hr-gurugram-0-to-1-years-190326022622
Data Analyst,Data Analyst,S&P Global Market Intelligence,0-2 yrs,Gurugram,"data analyst, data analytics, power bi, analytical skills, environmental science, research, sustainability reporting, sql",3 weeks ago,https://www.naukri.com/job-listings-data-analyst-s-p-capital-iq-india-pvt-ltd-gurugram-0-to-2-years-100326927740
Data Analyst,Data analyst,Inginit,0-3 yrs,Mumbai,"master data, metadata, python, data analysis, data management, data analytics, data validation, configuration",3+ weeks ago,https://www.naukri.com/job-listings-data-analyst-inginit-mumbai-0-to-3-years-020925501272
Data Analyst,Data Analyst,Hiringhood,1-3 yrs,Mangaluru,"Pyspark, Pandas, Data Analytics, Python, SQL, Azure Cloud, Data Structures, Ci/Cd",1 week ago,https://www.naukri.com/job-listings-data-analyst-hiringhood-mangaluru-1-to-3-years-130326024180
Data Analyst,Data Analyst (Deployment),Legistify,0-2 yrs,Gurugram,"metadata, python, data analysis, data management, data analytics, data validation, configuration, data mining",3+ weeks ago,https://www.naukri.com/job-listings-data-analyst-deployment-legistify-gurugram-0-to-2-years-221124503740
Data Analyst,Data Engineer / Analyst,We Shine Academy,0-3 yrs,Chennai,"hive, python, data analysis, data analytics, oracle, scala, data mining, data warehousing",3+ weeks ago,https://www.naukri.com/job-listings-data-engineer-analyst-we-shine-academic-chennai-0-to-3-years-080125502324
Data Analyst,Data Analyst,K12 Techno Services,1-3 yrs,Bengaluru,"Advanced Excel, Data Reporting, Transport Operations, Transport Management, Pivot Table, VLOOKUP, Fleet Management, Data Management",1 week ago,https://www.naukri.com/job-listings-data-analyst-k12-techno-services-bengaluru-1-to-3-years-240326019466
Data Analyst,Data Analyst,Grid Dynamics,10-20 yrs,Bengaluru,"Power Bi, Data, Dashboards, Bi, Data analysis",6 days ago,https://www.naukri.com/job-listings-data-analyst-grid-dynamics-bengaluru-10-to-20-years-270326021153
Machine Learning Engineer,Artificial Intelligence / Machine Learning Engineer Lead,FIS,10-15 yrs,Pune,"llm, insurance, trading, rest, mlops, python, restful, ai",1 week ago,https://www.naukri.com/job-listings-artificial-intelligence-machine-learning-engineer-lead-fis-global-business-solutions-india-pvt-ltd-pune-10-to-15-years-250326915179
Machine Learning Engineer,Principal Machine Learning Engineer,Amgen Inc,10-15 yrs,Hyderabad,"Machine Learning, mlops, python, aws sagemaker, databricks, llm, gdpr, tensorflow",1 week ago,https://www.naukri.com/job-listings-principal-machine-learning-engineer-amgen-inc-hyderabad-10-to-15-years-200326912697
Machine Learning Engineer,"Engineer Lead, Artificial Intelligence / Machine Learning",FIS,10-15 yrs,Pune,"data scientist, python, forecasting, ai, numpy, machine learning, artificial intelligence, nosql",2 weeks ago,https://www.naukri.com/job-listings-engineer-lead-artificial-intelligence-machine-learning-fis-global-business-solutions-india-pvt-ltd-pune-10-to-15-years-190326920773
Machine Learning Engineer,Data Science-Machine learning Engineer,EXL,0-3 yrs,Gurugram,"Marketing analytics, QC, C, SAS, Analytical, Machine learning, Programming, Data analytics",1 day ago,https://www.naukri.com/job-listings-data-science-machine-learning-engineer-exl-services-com-i-pvt-ltd-gurugram-0-to-3-years-020426509943
Machine Learning Engineer,Principal Machine Learning Engineer,Siemens,10-15 yrs,Noida,"machine learning, rds, kubernetes, docker, lambda, iam, spark, pytorch",6 days ago,https://www.naukri.com/job-listings-principal-machine-learning-engineer-siemens-limited-noida-10-to-15-years-270326918189
Machine Learning Engineer,Associate Director - Machine Learning Engineer,S&P Global Market Intelligence,10-15 yrs,Hyderabad,"machine learning, kubernetes, sql, microservices, docker, data science, spark, apache spark",1 day ago,https://www.naukri.com/job-listings-associate-director-machine-learning-engineer-s-p-capital-iq-india-pvt-ltd-hyderabad-10-to-15-years-020426929125
Machine Learning Engineer,Machine Learning Engineer,Agdata,10-20 yrs,Hybrid - Pune(Balewadi),"Data Science, Machine Learning, Deep Learning, Python, SQL, Artificial Intelligence, ETL, Science",2 days ago,https://www.naukri.com/job-listings-machine-learning-engineer-agdata-pune-10-to-20-years-310326034911
Machine Learning Engineer,Artificial Intelligence / Machine Learning Engineer Lead,FIS,10-15 yrs,Pune,"machine learning, insurance, trading, rest, mlops, python, restful, ai",1 week ago,https://www.naukri.com/job-listings-artificial-intelligence-machine-learning-engineer-lead-fis-global-business-solutions-india-pvt-ltd-pune-10-to-15-years-250326915182
AI Engineer,Artificial Intelligence Engineer,WABAG,10-18 yrs,Chennai,"Process Automation, AI, Data Analytics, Process, Intelligence, Analytics, Artificial Intelligence, Automation",3 weeks ago,https://www.naukri.com/job-listings-artificial-intelligence-engineer-wabag-chennai-10-to-18-years-110326035852
Data Engineer,BTS A: Data Engineer,ZS,0-3 yrs,"New Delhi, Gurugram","SQL, ETL, AWS, Python, S3, Airflow, Pyspark, Redshift",2 weeks ago,https://www.naukri.com/job-listings-bts-a-data-engineer-zs-new-delhi-gurugram-0-to-3-years-140326011286
Frontend Developer,Frontend Developer,Foxiom Leads,0-1 yrs,Kozhikode,"frontend development, front end, emerging technologies, css, ui development, user interface designing, photoshop, bootstrap",3+ weeks ago,https://www.naukri.com/job-listings-frontend-developer-foxiom-leads-pvt-ltd-kozhikode-0-to-1-years-301025503066
Frontend Developer,Frontend Developer,TechKnowledgeHub.org,0-2 yrs,Remote,"Front end, Scalability, html5, Shaping, Web development, Javascript, HTML, Information technology",3+ weeks ago,https://www.naukri.com/job-listings-frontend-developer-techknowledgehub-org-remote-0-to-2-years-220424500456
Frontend Developer,Frontend Developer,Techsolv It Service,0-2 yrs,Bardhaman,"frontend development, front end, emerging technologies, css, ui development, user interface designing, photoshop, bootstrap",3+ weeks ago,https://www.naukri.com/job-listings-frontend-developer-techsolv-it-service-bardhaman-0-to-2-years-250325505417
Frontend Developer,Frontend Developer,Clumpcoder,0-1 yrs,Indore,"react.js, frontend development, front end, web application, web technologies, Front, Development, Application",3+ weeks ago,https://www.naukri.com/job-listings-frontend-developer-clumpcoder-indore-0-to-1-years-200126505068
Frontend Developer,Frontend Developer,Shrewd Business Solutions,0-2 yrs,Coimbatore,"frontend development, front end, emerging technologies, css, ui development, user interface designing, photoshop, bootstrap",3+ weeks ago,https://www.naukri.com/job-listings-frontend-developer-shrewd-business-solutions-coimbatore-0-to-2-years-131125503792
Frontend Developer,Frontend Developer,Imperative Business Ventures,0-2 yrs,Pune,"redux, css, ui development, bootstrap, ajax, scalability, jquery, react.js",3+ weeks ago,https://www.naukri.com/job-listings-frontend-developer-imperative-business-ventures-pvt-ltd-pune-0-to-2-years-251025503911
Frontend Developer,Frontend Developer,Metconnect Infotech,0-1 yrs,Patna,"Backend, Front end, Web technologies, html5, Javascript, CSS3, HTML, Frontend Development",3+ weeks ago,https://www.naukri.com/job-listings-frontend-developer-metconnect-infotech-pvt-ltd-patna-0-to-1-years-240226502078
Frontend Developer,Frontend Developer,Link Ideas Technologies,0-3 yrs,Bhilai,"redux, css, web application, ui development, bootstrap, ajax, jquery, react.js",3+ weeks ago,https://www.naukri.com/job-listings-frontend-developer-link-ideas-technologies-bhilai-0-to-3-years-270525502135
Frontend Developer,Frontend Developer,Swipfe Infotech,0-2 yrs,Pune,"Backend, jQuery, Debugging, Javascript, Web designing, JSON, SEO, Software services",3+ weeks ago,https://www.naukri.com/job-listings-frontend-developer-swipfe-infotech-pvt-ltd-pune-0-to-2-years-191225502792
Frontend Developer,Frontend Developer,Appentus Technologies,0-3 yrs,Jaipur,"Backend, CSS, Version control, GIT, Front end, Scalability, Debugging, Javascript",3+ weeks ago,https://www.naukri.com/job-listings-frontend-developer-appentus-technologies-jaipur-0-to-3-years-200825500997
Frontend Developer,Frontend Developer,Flying Lion Media,0-3 yrs,Ahmedabad,"frontend development, front end, emerging technologies, css, ui development, user interface designing, photoshop, bootstrap",3+ weeks ago,https://www.naukri.com/job-listings-frontend-developer-flying-lion-media-ahmedabad-0-to-3-years-111125502491
Frontend Developer,Frontend Developer,Famepilot,0-2 yrs,Gurgaon,"UI development, POP, github, Front end, Data structures, wireframing, HTML, Customer support",3+ weeks ago,https://www.naukri.com/job-listings-frontend-developer-famepilot-internet-gurgaon-0-to-2-years-140220500671
Frontend Developer,Frontend Developer,riz Software Consultancy,0-3 yrs,Kolkata,"frontend development, front end, emerging technologies, css, ui development, user interface designing, photoshop, bootstrap",3+ weeks ago,https://www.naukri.com/job-listings-frontend-developer-riz-software-consultancy-kolkata-0-to-3-years-080125502408
Frontend Developer,Frontend Developer,Cumulations,0-1 yrs,Bengaluru,"Backend, Front end, orchestration, devops, MySQL, Cloud, Agile, MongoDB",3+ weeks ago,https://www.naukri.com/job-listings-frontend-developer-cumulations-technologies-pvt-ltd-bengaluru-0-to-1-years-161025500817
Frontend Developer,Frontend Developer (m/k/d),Bluesoft Software Solution,0-3 yrs,Remote,"Cloud computing, Manager Quality Assurance, RDBMS, Coding, Project management, Consulting, power bi, Workflow",6 days ago,https://www.naukri.com/job-listings-frontend-developer-m-k-d-bluesoft-software-solution-remote-0-to-3-years-270326502386
Frontend Developer,Frontend Developer,Anantya.ai,0-2 yrs,New Delhi,"frontend development, rest, front end, redux, css, web application, version control, ui development",2 weeks ago,https://www.naukri.com/job-listings-frontend-developer-anantya-ai-new-delhi-0-to-2-years-170326503317
Frontend Developer,FRONT END DEVELOPER,Godigi Infotech,0-1 yrs,Pune,"Performance tuning, Backend, build automation, CSS, Front end, Web technologies, Debugging, JSON",3+ weeks ago,https://www.naukri.com/job-listings-front-end-developer-godigi-infotech-pune-0-to-1-years-031225503040
Frontend Developer,Frontend Developer,Pavans Group Techsoft,0-2 yrs,Vadodara,"Front end, Focus, Management, manage, coordination, Frontend Development, End, Development",2 weeks ago,https://www.naukri.com/job-listings-frontend-developer-pavans-group-techsoft-private-limited-vadodara-0-to-2-years-180326500637
Frontend Developer,Trainee UX/Frontend Developer,Evision It Solution,0-2 yrs,Gandhinagar,"jQuery, Front end, Web development, Javascript, Conceptualization, Manager Technology, Programming, HTML",3+ weeks ago,https://www.naukri.com/job-listings-trainee-ux-frontend-developer-evision-it-solutions-gandhinagar-0-to-2-years-211124505979
Frontend Developer,Frontend Developer,Crypton Tech,0-1 yrs,Erode,"Backend, Version control, GIT, Postgresql, Web development, Javascript, HTML, MongoDB",3+ weeks ago,https://www.naukri.com/job-listings-frontend-developer-crypton-tech-p-ltd-erode-0-to-1-years-251025505517
Frontend Developer,Frontend Developer Intern,Creativewebo,0-1 yrs,Navi Mumbai,"Javascript, React.Js, Ui/Ux, Ux Design, CSS, Sass, HTML, User Interface Designing",1 week ago,https://www.naukri.com/job-listings-frontend-developer-intern-creativewebo-navi-mumbai-0-to-1-years-240326930383
Frontend Developer,Frontend Developer,Itier Solutions,0-1 yrs,Pune,"CSS, jQuery, Front end, ASP.Net, HTML, Photoshop, Cs, Frontend Development",3+ weeks ago,https://www.naukri.com/job-listings-frontend-developer-itier-solutions-pune-0-to-1-years-151225503038
Frontend Developer,Frontend developers,Astech Solutions,0-3 yrs,Mumbai,"CSS, jQuery, Front end, GIT, Web technologies, Wordpress, Javascript, HTML",3+ weeks ago,https://www.naukri.com/job-listings-frontend-developers-astech-solutions-mumbai-0-to-3-years-231220501688
Frontend Developer,Frontend Developer,Seyon Business Innovation,0-1 yrs,Coimbatore,"CSS, Front end, Web technologies, Javascript, HTML, Cs, Front, Development",3+ weeks ago,https://www.naukri.com/job-listings-frontend-developer-seyon-business-innovation-coimbatore-0-to-1-years-101225501799
Frontend Developer,Frontend Developer,Acetrot,0-3 yrs,Mumbai,"Front end, Development, Frontend Development, Front, End",3+ weeks ago,https://www.naukri.com/job-listings-frontend-developer-acetrot-mumbai-0-to-3-years-090824502207
Frontend Developer,Frontend Developer,Infizius,0-1 yrs,"Mumbai, Surat","Front end, Frontend Development, End, Development, Front",3+ weeks ago,https://www.naukri.com/job-listings-frontend-developer-infizius-mumbai-surat-0-to-1-years-201124513169
Frontend Developer,Frontend Developer (React),Leifii.Co,0-1 yrs,Pune,"redux, css, web application, ui development, bootstrap, ajax, jquery, react.js",1 day ago,https://www.naukri.com/job-listings-frontend-developer-react-leifii-co-pune-0-to-1-years-010426505583
Frontend Developer,Front End Developer,Ipropal,0-2 yrs,"Kolkata, Mumbai, New Delhi, Hyderabad, Pune, Chennai, Bengaluru","Computer science, Basic, Backend, github, Front end, GIT, Web technologies, Javascript",1 day ago,https://www.naukri.com/job-listings-front-end-developer-ipropal-allps-kolkata-mumbai-new-delhi-hyderabad-pune-chennai-bengaluru-0-to-2-years-010426505767
Frontend Developer,Frontend Developer,Milestone Infosoft Solutions,0-3 yrs,Mumbai,"Backend, Web technologies, Front end, Web development, Javascript, Front, End, Frontend Development",3+ weeks ago,https://www.naukri.com/job-listings-frontend-developer-milestone-infosoft-solutions-private-limited-mumbai-0-to-3-years-211124507509
Frontend Developer,Frontend Developer Intern,Avian Experiences,0-2 yrs,Ahmedabad,"nextjs, redux, css, ui development, vue.js, bootstrap, ajax, jquery",3+ weeks ago,https://www.naukri.com/job-listings-frontend-developer-intern-avian-experiences-ahmedabad-0-to-2-years-240125501801
Frontend Developer,Jr. Frontend Developer,Enzigma Software,0-1 yrs,Pune,"Computer science, jQuery, GIT, Networking, Coding, Web development, Javascript, HTML",2 weeks ago,https://www.naukri.com/job-listings-jr-frontend-developer-enzigma-software-pvt-ltd-pune-0-to-1-years-170326501822
Frontend Developer,Front-End Developer,Supercode,0-1 yrs,Bengaluru,"frontend development, front end, css, web application, wordpress, cms, front end technologies, backend development",3+ weeks ago,https://www.naukri.com/job-listings-front-end-developer-supercode-bengaluru-0-to-1-years-010725503419
Frontend Developer,Frontend Developer Trainee,eAspire Technolabs Inc.,0-1 yrs,Lucknow,"Angularjs, Javascript, React.Js, Training, Front end, Development, Training And Development",1 week ago,https://www.naukri.com/job-listings-frontend-developer-trainee-evoke-hr-lucknow-0-to-1-years-250326028875
Frontend Developer,Frontend Developer,PRODAT,1-3 yrs,Bengaluru,"frontend development, front end, emerging technologies, css, ui development, user interface designing, photoshop, bootstrap",3+ weeks ago,https://www.naukri.com/job-listings-frontend-developer-prodat-bengaluru-1-to-3-years-131125503844
Frontend Developer,Frontend Developer,Yugasys Software,1-3 yrs,Bengaluru,"frontend development, front end, emerging technologies, css, ui development, user interface designing, photoshop, bootstrap",3+ weeks ago,https://www.naukri.com/job-listings-frontend-developer-yugasys-software-bengaluru-1-to-3-years-161025501353
Frontend Developer,Creative Frontend Developer Intern AI Powered,Utsavy,0-2 yrs,Jaipur,"Training, CSS, Usage, Front end, Web technologies, Intern, Coding, Javascript",3+ weeks ago,https://www.naukri.com/job-listings-creative-frontend-developer-intern-ai-powered-utsavy-jaipur-0-to-2-years-310126502631
Backend Developer,Backend Developer For WK,EXL,1-3 yrs,New Delhi,"Performance tuning, Front end, Data modeling, Billing, Javascript, HTTP, microsoft, Analytics",3+ weeks ago,https://www.naukri.com/job-listings-backend-developer-for-wk-exl-services-com-i-pvt-ltd-new-delhi-1-to-3-years-160226506016
Backend Developer,Backend Developer,Vibencode,1-3 yrs,Indore,"Backend, Networking, Django, Debugging, Data structures, System design, data integrity, Distribution system",1 day ago,https://www.naukri.com/job-listings-backend-developer-vibencode-indore-1-to-3-years-010426504520
Backend Developer,Backend Developer,STUTZEN,0-1 yrs,Sivakasi,"C++, Backend, Hibernate, Manager Quality Assurance, Coding, PHP, test driven development, JSF",2 weeks ago,https://www.naukri.com/job-listings-backend-developer-stutzen-corporates-private-limited-sivakasi-0-to-1-years-190326505447
Backend Developer,Backend developer,Fan Tv Ai,0-2 yrs,Noida,"Nodejs, IIT, Backend developer, NIT, Tier 1 college, Python, Backend Development, Backend",2 days ago,https://www.naukri.com/job-listings-backend-developer-fan-tv-ai-noida-0-to-2-years-310326913210
Backend Developer,Rust Backend Developer,Alkye Services,0-1 yrs,Mohali(Phase 8 Industrial Area),"Rust, Actix, Docker, Kubernetes, Development, Backend",1 day ago,https://www.naukri.com/job-listings-rust-backend-developer-alkye-services-mohali-0-to-1-years-020426024790
Backend Developer,backend developer,Routematic,0-3 yrs,Bengaluru,"Backend, Interpersonal skills, Front end, GIT, Analytical, Javascript, Continuous improvement, SQL",3+ weeks ago,https://www.naukri.com/job-listings-backend-developer-routematic-bengaluru-0-to-3-years-121125500441
Backend Developer,Backend Developer,Flying Lion Media,0-2 yrs,Ahmedabad,"server, css, web application architecture, dbms, ajax, jquery, sql, database design",3+ weeks ago,https://www.naukri.com/job-listings-backend-developer-flying-lion-media-ahmedabad-0-to-2-years-111125502500
Backend Developer,Backend Developer |,Lambdatest,1-3 yrs,Noida,"Backend, Architecture, Coding, Analytical, Cloud, Wellness, Distribution system, Team building",1 week ago,https://www.naukri.com/job-listings-backend-developer-lambdatest-noida-1-to-3-years-250326506317
Backend Developer,Backend Developer,The Fast Way,0-2 yrs,"Mumbai, Navi Mumbai","Health insurance, SIDE, Front end, Version control, GIT, Coding, data security, MySQL",3+ weeks ago,https://www.naukri.com/job-listings-backend-developer-the-fast-way-mumbai-navi-mumbai-0-to-2-years-301225505178
Backend Developer,Backend Developer,Anantya.ai,0-1 yrs,New Delhi,"css, screening, hibernate, jquery, sourcing, sql, microservices, spring",2 weeks ago,https://www.naukri.com/job-listings-backend-developer-anantya-ai-new-delhi-0-to-1-years-170326503318
Backend Developer,Backend Developer,Metconnect Infotech,0-1 yrs,Patna,"spring boot, Backend, Architecture, Postgresql, MySQL, Debugging, AWS, microservices",3+ weeks ago,https://www.naukri.com/job-listings-backend-developer-metconnect-infotech-pvt-ltd-patna-0-to-1-years-240226502070
Backend Developer,Backend Developer,Link Ideas Technologies,0-3 yrs,Bhilai,"css, c++, bootstrap, hibernate, ajax, jquery, sql, react.js",3+ weeks ago,https://www.naukri.com/job-listings-backend-developer-link-ideas-technologies-bhilai-0-to-3-years-270525502132
Backend Developer,Backend Developer,Requin Solutions,0-1 yrs,Jaipur,"web application architecture, dbms, ajax, jquery, sql, database design, spring, java",3+ weeks ago,https://www.naukri.com/job-listings-backend-developer-requin-group-jaipur-0-to-1-years-280625501253
