search_role,job_title,company_name,experience,location,skills,posted_date,job_link
Android Developer,Android Developer,G10 Consultancy,0-2 yrs,Mumbai,"Computer science, Usage, Technology consulting, Agile, Software development life cycle, Programming, Consultancy, Scrum",3+ weeks ago,https://www.naukri.com/job-listings-android-developer-g10-consultancy-mumbai-0-to-2-years-161224501488
Android Developer,Android Developer,Vocsy Infotech,0-2 yrs,Surat,"rest, c++, css, ux, software development, sqlite, software testing, user interface designing",3+ weeks ago,https://www.naukri.com/job-listings-android-developer-vocsy-infotech-surat-0-to-2-years-080724503110
Android Developer,ANDROID DEVELOPER,Godigi Infotech,0-1 yrs,Pune,"Android, Android Application Development, Development",3+ weeks ago,https://www.naukri.com/job-listings-android-developer-godigi-infotech-pune-0-to-1-years-061123500782
Android Developer,Android Developer,Riseup Infotech,0-3 yrs,Surat,"C++, Layout design, Coding, android studio, JSON, Android SDK, Management, Proof reading",3+ weeks ago,https://www.naukri.com/job-listings-android-developer-riseup-infotech-surat-0-to-3-years-200224500833
Android Developer,AI First_ Android Developer,Primary Healthtech,0-1 yrs,Noida(Sector 6),"Java, Android Studio, Kotlin, android sdk, Rest Api Integration, ai coding, Artificial Intelligence, Integration",3 weeks ago,https://www.naukri.com/job-listings-ai-first-android-developer-primary-healthtech-noida-0-to-1-years-110326014855
Android Developer,Android Developer,Tekskills india pvt ltd,10-20 yrs,Hybrid - Hyderabad,"Application Development, Java, Kotlin, Application, Development, Android Application Development, Android",1 week ago,https://www.naukri.com/job-listings-android-developer-tekskills-hyderabad-10-to-20-years-230326003139
Android Developer,Android Developer,Forefront Infotech,0-1 yrs,Surat,"Android Developer, APIs and data sources, Android Application Development, Development, Android, Data, Source, API",3+ weeks ago,https://www.naukri.com/job-listings-android-developer-forefront-infotech-surat-0-to-1-years-221021500995
Android Developer,Android Developer,Invitereferrals Delhi,0-2 yrs,New Delhi,"c++, sqlite, mvp, android, android studio, kotlin, mobile application development, firebase",3+ weeks ago,https://www.naukri.com/job-listings-android-developer-invitereferrals-new-delhi-0-to-2-years-180226502772
Android Developer,Android Developer,Codunite,0-2 yrs,Jaipur,"c++, software development, c, sqlite, mvp, android, kotlin, android studio",3+ weeks ago,https://www.naukri.com/job-listings-android-developer-codunite-jaipur-0-to-2-years-120925502803
Android Developer,Android Developer,Primecore Solutions,0-1 yrs,Hyderabad,"Multithreading, Web services, SOAP, Analytics, Android, google maps, Cartography, Development",3+ weeks ago,https://www.naukri.com/job-listings-android-developer-primecore-solutions-hyderabad-0-to-1-years-060923500912
Android Developer,ANDROID Developer,Neolite Infotech,0-2 yrs,Mumbai,"Computer science, Web services, java, application, web, XML, SQLite, mobile",3+ weeks ago,https://www.naukri.com/job-listings-android-developer-neolite-infotech-india-pvt-ltd-mumbai-0-to-2-years-051118501064
Android Developer,Android Developer,Prabhu Studio,0-1 yrs,Gandhinagar,"c++, css, android, bug fixing, coding, requirement gathering, java, git",3+ weeks ago,https://www.naukri.com/job-listings-android-developer-prabhu-studio-gandhinagar-0-to-1-years-020925501235
Android Developer,Android Developer,Walk Digitally,0-3 yrs,Cuttack,"innovation, excel, stakeholder management, multitasking, analytical skills, work ethics, Management, Android",3+ weeks ago,https://www.naukri.com/job-listings-android-developer-walk-digitally-cuttack-0-to-3-years-301225506252
Android Developer,Android developer,Aspiration Solutions,0-3 yrs,Surat,"c++, css, android, bug fixing, coding, requirement gathering, java, git",3+ weeks ago,https://www.naukri.com/job-listings-android-developer-aspiration-solutions-surat-0-to-3-years-050724501578
Android Developer,Android Developer,Nevonprojects,0-2 yrs,Mumbai,"Performance tuning, Automation, Backend, User interface designing, Manager Technology, Electronics, Android SDK, Research",3+ weeks ago,https://www.naukri.com/job-listings-android-developer-nevonprojects-mumbai-0-to-2-years-301122501683
Android Developer,Android Developer,Ieverware,0-3 yrs,Hyderabad,"MS SQL, Coding, .Net, SQL coding, Android, SQL Server, Microsoft, Android Application Development",3+ weeks ago,https://www.naukri.com/job-listings-android-developer-ieverware-hyderabad-0-to-3-years-040822501066
Flutter Developer,Jr. Flutter Developer,Website Developers India,0-1 yrs,Mumbai,"rest, c++, sqlite, android, flutter development, mobile application development, iphone, javascript",3+ weeks ago,https://www.naukri.com/job-listings-jr-flutter-developer-website-developers-india-mumbai-0-to-1-years-241125502848
Flutter Developer,Assistant Flutter Developer (Junior / Associate Developer),Spacedge Creation,0-1 yrs,Mumbai,"Computer science, Backend, Version control, Coding, Web development, Debugging, Javascript, Junior Associate",6 days ago,https://www.naukri.com/job-listings-assistant-flutter-developer-junior-associate-developer-spacedge-creation-mumbai-0-to-1-years-270326506569
Flutter Developer,Flutter Developer,Rishabraj Estate Developers,1-3 yrs,Mumbai(Borivali East),"Flutter, Dart, Swift, IOS, Android, Kotlin, Development, Flutter Development",1 day ago,https://www.naukri.com/job-listings-flutter-developer-rishabraj-estate-developers-mumbai-1-to-3-years-020426016668
Flutter Developer,Flutter Developer,Vocsy Infotech,0-2 yrs,Surat,"rest, c++, sqlite, android, flutter development, mobile application development, iphone, javascript",3+ weeks ago,https://www.naukri.com/job-listings-flutter-developer-vocsy-infotech-surat-0-to-2-years-080724503111
Flutter Developer,Flutter Developer,Appworld Infotech,0-1 yrs,Surat,"Packaging, IOS, Android, Flutter, Flutter Development, Io, Development",3+ weeks ago,https://www.naukri.com/job-listings-flutter-developer-appworld-infotech-surat-0-to-1-years-150323500069
Flutter Developer,Flutter Developer,Livelyworks,0-2 yrs,Nagpur,"rest, c++, sqlite, android, flutter development, mobile application development, iphone, javascript",3+ weeks ago,https://www.naukri.com/job-listings-flutter-developer-livelyworks-nagpur-0-to-2-years-280624502803
Flutter Developer,Flutter Developer,Idreamdevelopers,0-2 yrs,Coimbatore,"rest, c++, sqlite, android, flutter development, mobile application development, iphone, javascript",3+ weeks ago,https://www.naukri.com/job-listings-flutter-developer-idreamdevelopers-coimbatore-0-to-2-years-291025503231
Flutter Developer,Flutter Developer,Nascenture Software Solutions,0-2 yrs,Mohali,"c++, c, sqlite, android, flutter development, mobile application development, iphone, javascript",3+ weeks ago,https://www.naukri.com/job-listings-flutter-developer-nascenture-software-solutions-mohali-0-to-2-years-031125504883
Flutter Developer,Flutter Developer,Link Ideas Technologies,0-3 yrs,Bhilai,"css, android, flutter development, mobile application development, ios, dart, java, ui",3+ weeks ago,https://www.naukri.com/job-listings-flutter-developer-link-ideas-technologies-bhilai-0-to-3-years-270525502134
Flutter Developer,Flutter Developer,Innsof,0-1 yrs,Kozhikode,"rest, c++, c, sqlite, android, flutter development, mobile application development, iphone",3+ weeks ago,https://www.naukri.com/job-listings-flutter-developer-innsof-pvt-ltd-kozhikode-0-to-1-years-041125501608
Flutter Developer,Flutter Developer,RCK Infosystem,0-1 yrs,Dhanbad,"rest, c++, c, sqlite, android, flutter development, mobile application development, iphone",3+ weeks ago,https://www.naukri.com/job-listings-flutter-developer-rck-infosystem-opc-private-limited-dhanbad-0-to-1-years-270624500948
Flutter Developer,Flutter Developer (1-3 yrs),Smarthms Solutions,1-3 yrs,Thiruvananthapuram,"Javascript, Flutter, Dart, Html/Css, HTML, Cs, HTML, Flutter Development",1 week ago,https://www.naukri.com/job-listings-flutter-developer-1-3-yrs-smarthms-solutions-thiruvananthapuram-1-to-3-years-250326021636
Flutter Developer,FLUTTER APP DEVELOPER,Jharkhand It Services,0-1 yrs,Ranchi,"rest, css, c++, c, sqlite, android, android studio, kotlin",3+ weeks ago,https://www.naukri.com/job-listings-flutter-app-developer-jharkhand-it-services-ranchi-0-to-1-years-110724502176
Flutter Developer,Flutter Developer,Invennico Technolabs,1-3 yrs,Vadodara,"BLoc, Flutter Development, Ios Deployed, Dart, Android Deployed, English, Api Integration, Hindi",2 days ago,https://www.naukri.com/job-listings-flutter-developer-invennico-technolabs-vadodara-1-to-3-years-310326018431
Flutter Developer,Flutter Developer,VPN Infotech,1-3 yrs,Surat,"rest, c++, c, sqlite, android, flutter development, mobile application development, iphone",3+ weeks ago,https://www.naukri.com/job-listings-flutter-developer-vpn-infotech-surat-1-to-3-years-210524500701
Flutter Developer,Junior Flutter Developer,Appsmartz,0-2 yrs,Mohali,"Mobile applications, Flutter, Application, Development",3+ weeks ago,https://www.naukri.com/job-listings-junior-flutter-developer-appsmartz-mohali-0-to-2-years-160925503938
Flutter Developer,Flutter app developer,Uncharted Infolabs,0-2 yrs,Gurugram,"server, css, c++, android, flutter development, mobile application development, dart, java",3+ weeks ago,https://www.naukri.com/job-listings-flutter-app-developer-enrichai-gurugram-0-to-2-years-270624501061
Flutter Developer,Flutter Developer,Akash Technolabs,0-2 yrs,Ahmedabad,"Analytical skills, Basic, User interface designing, Eclipse, SQLite, android studio, JSON, Android SDK",3+ weeks ago,https://www.naukri.com/job-listings-flutter-developer-akash-technolabs-ahmedabad-0-to-2-years-120424502548
Flutter Developer,Flutter Developer,OM Software,1-3 yrs,Pune,"software development, ux, web services, software testing, sqlite, android, android studio, kotlin",3+ weeks ago,https://www.naukri.com/job-listings-flutter-developer-om-softwares-pune-1-to-3-years-060226507073
Flutter Developer,Flutter Developer,Encoders Technologies,1-3 yrs,Kolkata(Salt Lake),"Flutter, Flutter Development, Android Application Development, English, Bengali, Mobile Development, Ios Development, Hindi",1 day ago,https://www.naukri.com/job-listings-flutter-developer-encoders-technologies-kolkata-1-to-3-years-020426017772
Flutter Developer,Flutter Developer,Flitzen,1-3 yrs,Rajkot,"Computer science, Training, Backend, github, GIT, PDF, Banking, Management",1 week ago,https://www.naukri.com/job-listings-flutter-developer-flitzen-technologies-opc-private-limited-rajkot-1-to-3-years-200326500473
Flutter Developer,Flutter Developer,Andswitch Tech,0-3 yrs,Rajkot,"Performance tuning, continuous integration, Backend, GIT, User interface designing, Programming, Unit testing, Management",3+ weeks ago,https://www.naukri.com/job-listings-flutter-developer-andswitchtech-rajkot-0-to-3-years-061025501009
Flutter Developer,Junior Flutter Developer,Mother Software And Technology Services,0-3 yrs,Tiruchirapalli,"CVS, C++, Front end, Debugging, Javascript, Agile, HTML, Scrum",3+ weeks ago,https://www.naukri.com/job-listings-junior-flutter-developer-mother-software-and-technology-services-tiruchirapalli-0-to-3-years-210324500860
Flutter Developer,Flutter Developer,Maxlink It Solutions,0-1 yrs,Vadodara,"Software project, continuous integration, Version control, GIT, PDF, android studio, Deployment, IOS",3+ weeks ago,https://www.naukri.com/job-listings-flutter-developer-maxlink-it-solutions-pvt-ltd-vadodara-0-to-1-years-090223502753
Flutter Developer,Flutter Developer,W3cert,0-2 yrs,Coimbatore,"Front end, Version control, Networking, Subversion, MySQL, Debugging, PHP, HTTP",3+ weeks ago,https://www.naukri.com/job-listings-flutter-developer-w3cert-coimbatore-0-to-2-years-150125503398
Flutter Developer,Flutter Developer,Fruxinfo,0-1 yrs,Ahmedabad,"UI development, Backend, Version control, GIT, Mobile applications, Management, Troubleshooting, IOS",3+ weeks ago,https://www.naukri.com/job-listings-flutter-developer-fruxinfo-private-limited-ahmedabad-0-to-1-years-111125503018
Flutter Developer,Flutter Developer,Savyasachi Infotech,0-2 yrs,Surat,"Manager Quality Assurance, Mobile development, Consulting, Javascript, Packaging, System design, bootstrap, IOS",3+ weeks ago,https://www.naukri.com/job-listings-flutter-developer-savyasachiinfotech-surat-0-to-2-years-090524500840
Flutter Developer,Flutter Developer,Innspark Solutions,0-3 yrs,Kollam,"Performance tuning, software architecture, Version control, GIT, MVVM, TDD, GCP, Management systems",3+ weeks ago,https://www.naukri.com/job-listings-flutter-developer-innspark-kollam-0-to-3-years-131224503253
Flutter Developer,Flutter Developer,Swan Softweb,0-1 yrs,Ahmedabad,"Performance tuning, Automation testing, GIT, Version control, User interface designing, Agile development, Swift, IOS",3+ weeks ago,https://www.naukri.com/job-listings-flutter-developer-swansoftwebsolutions-ahmedabad-0-to-1-years-160623501776
Flutter Developer,Senior Flutter Developer,Mother Software And Technology Services,0-3 yrs,Tiruchirapalli,"CVS, C++, Front end, Debugging, Javascript, Agile, HTML, Scrum",3+ weeks ago,https://www.naukri.com/job-listings-senior-flutter-developer-mother-software-and-technology-services-tiruchirapalli-0-to-3-years-210324500855
Flutter Developer,Flutter Developer,B2E Technology,1-3 yrs,Chennai,"rest, css, c++, c, sqlite, android, android studio, kotlin",3+ weeks ago,https://www.naukri.com/job-listings-flutter-developer-b2e-technology-pvt-ltd-chennai-1-to-3-years-291025504095
Flutter Developer,Flutter Developer,Sivacerulean Technologies,1-3 yrs,Hybrid - Chennai,"Flutter, IOS, Kotlin, Dart, Android, Io, Development, Flutter Development",2 weeks ago,https://www.naukri.com/job-listings-flutter-developer-sivacerulean-technologies-chennai-1-to-3-years-170326033596
QA Engineer,QA Engineer,Zuru Edge,1-3 yrs,Kolkata,"Computer science, GIT, AutoCAD, Functional testing, Debugging, Scrum, Test cases, Manager Quality Control",2 weeks ago,https://www.naukri.com/job-listings-qa-engineer-zuru-edge-kolkata-1-to-3-years-190326504628
QA Engineer,QA Engineer,Voyon,1-3 yrs,"Kochi, Chennai","Computer science, Automation, Manager Quality Assurance, Test scripts, Javascript, Workflow, Selenium, Test cases",2 days ago,https://www.naukri.com/job-listings-qa-engineer-voyon-technology-services-pvt-ltd-kochi-chennai-1-to-3-years-310326501239
QA Engineer,Qa Engineer,Narayana Health (NH),1-3 yrs,Hybrid - Bengaluru,"BOT testing, Functional Testing, STLC, SQL, API Testing, Automation Testing, Software testing, Quality assurance engineering",1 week ago,https://www.naukri.com/job-listings-qa-engineer-narayana-health-nh-bengaluru-1-to-3-years-230326019071
QA Engineer,QA Engineer IoT Devices,Netradyne,1-3 yrs,Bengaluru,"SAN, Linux, Functional testing, Shell scripting, Debugging, Performance testing, Monitoring, Automotive",3 days ago,https://www.naukri.com/job-listings-qa-engineer-iot-devices-netradyne-bengaluru-1-to-3-years-300326502176
QA Engineer,QA Engineer,Technource,0-2 yrs,"Kolkata, Mumbai, New Delhi, Hyderabad, Pune, Chennai, Bengaluru","c, quality assurance, mobile applications, web technologies, manual testing, scrum, agile, Quality assurance engineering",1 week ago,https://www.naukri.com/job-listings-qa-engineer-technource-kolkata-mumbai-new-delhi-hyderabad-pune-chennai-bengaluru-0-to-2-years-200326505910
QA Engineer,QA Engineer,Tirupati Insurance,1-3 yrs,Hisar,"rest, quality control, software testing, quality audit, automation testing, manual testing, problem solving, engineering",3+ weeks ago,https://www.naukri.com/job-listings-qa-engineer-tirupati-insurance-hisar-1-to-3-years-180724501069
Test Engineer,Engineer - XR Test,Qualcomm,1-3 yrs,Bengaluru,"architecture, image processing, python, gaming, data analysis, multimedia technologies, ai, networking",1 week ago,https://www.naukri.com/job-listings-engineer-xr-test-qualcomm-india-pvt-ltd-bengaluru-1-to-3-years-270326909787
Test Engineer,Test Engineer,Bajaj Finance,1-3 yrs,Bengaluru,"qa engineer, css, python, ux, software testing, issue resolution, automation testing, sprint",1 day ago,https://www.naukri.com/job-listings-test-engineer-bajaj-finance-limited-bengaluru-1-to-3-years-020426911823
Test Engineer,Testing Engineers,Xiota,0-3 yrs,Bengaluru,"performance testing, regression testing, automation testing, test case execution, test cases, bugzilla, test scripts, stress testing",3+ weeks ago,https://www.naukri.com/job-listings-testing-engineers-xiota-bengaluru-0-to-3-years-250425501408
Test Engineer,TEST ENGINEER,Godigi Infotech,0-1 yrs,Pune,"Automation testing, Manual testing, Automation tools, QTP, Software testing, Manual, Automation, Tools",3+ weeks ago,https://www.naukri.com/job-listings-test-engineer-godigi-infotech-pune-0-to-1-years-061123500210
Test Engineer,Testing Engineer,Ultraliant,0-1 yrs,Nashik,"software testing, regression testing, automation testing, documentation, manual testing, test cases, software development life cycle, functional testing",3+ weeks ago,https://www.naukri.com/job-listings-testing-engineer-ultraliant-nashik-0-to-1-years-110724502513
Test Engineer,Test Engineer,Tangibleheed Infotech,1-3 yrs,Pune,"software testing, regression testing, automation testing, test cases, manual testing, smoke testing, functional testing, test engineering",3+ weeks ago,https://www.naukri.com/job-listings-test-engineer-tangibleheed-infotech-pune-1-to-3-years-240425500915
Test Engineer,Test Engineer,QualityKiosk,1-3 yrs,Mumbai,"Test case execution, Quality standards, Test planning, Test cases, Defect management, Planning, Software testing, Case",3 days ago,https://www.naukri.com/job-listings-test-engineer-qualitykiosk-mumbai-1-to-3-years-300326503465
Test Engineer,Test Engineer,Zebronics,0-1 yrs,Chennai,"Communication Skills, Electronic Components, PCB Knowledge, Hardware Testing, Gadget Testing, Peripheral Testing, Batch Testing, Test Engineer",1 week ago,https://www.naukri.com/job-listings-test-engineer-zebronics-chennai-0-to-1-years-230326003102
Test Engineer,Test Engineer,Expro Informatics India,1-3 yrs,Hyderabad,"Automation testing, Tracking, Testing tools, Defect tracking, Test execution, Black Box, Test cases, closure",3+ weeks ago,https://www.naukri.com/job-listings-test-engineer-expro-informatics-india-pvt-ltd-hyderabad-1-to-3-years-260917500614
Test Engineer,Test Engineer,QualityKiosk,1-3 yrs,Mumbai,"Usage, SAP, orchestration, Monitoring, Automation Lead, Testing, Test engineering, Software testing",1 week ago,https://www.naukri.com/job-listings-test-engineer-qualitykiosk-mumbai-1-to-3-years-200326500363
Test Engineer,Test Engineer,QualityKiosk,1-3 yrs,Mumbai,"Usage, SAP, orchestration, Monitoring, Automation Lead, Testing, Test engineering, Software testing",1 week ago,https://www.naukri.com/job-listings-test-engineer-qualitykiosk-mumbai-1-to-3-years-200326500362
Product Analyst,Product Analyst,MyGate,0-1 yrs,Bengaluru,"digital, confluence, data analytics, strong analytical skills, presentation skills, business analysis, google, problem solving",2 weeks ago,https://www.naukri.com/job-listings-product-analyst-mygate-bengaluru-0-to-1-years-170326503396
Product Analyst,Product Analyst,Fan Tv Ai,0-2 yrs,Noida,"Product Analysis, Product Analyst, dashboards reporting, PRDs, roadmap planning, user stories, Reporting, Roadmap",6 days ago,https://www.naukri.com/job-listings-product-analyst-fan-tv-ai-noida-0-to-2-years-270326927332
Product Analyst,Product Analyst,Exxat Systems,0-1 yrs,Vadodara,"Metrics, Insights, Product Analysis, Data Analysis, Reporting, Analysis, Data",1 week ago,https://www.naukri.com/job-listings-product-analyst-exxat-vadodara-0-to-1-years-200326504731
Product Analyst,Product Analyst,Uni Cards,0-3 yrs,Bengaluru,"competitor analysis, python, data analytics, data analysis, business analysis, business analytics, product analysis, user stories",2 days ago,https://www.naukri.com/job-listings-product-analyst-uni-card-bengaluru-0-to-3-years-310326502403
Product Analyst,Product Analyst,Cleartax,0-2 yrs,Bengaluru(Bommanahalli),"Excel, SQL, Product Analysis, SQL Queries, Analytics, Analysis, Query",3+ weeks ago,https://www.naukri.com/job-listings-product-analyst-cleartax-bengaluru-0-to-2-years-050326004397
Product Analyst,Product Analyst,Exxat Systems,1-3 yrs,Vadodara,"python, data analytics, data analysis, business analysis, product analysis, machine learning, business intelligence, sql server",1 week ago,https://www.naukri.com/job-listings-product-analyst-exxat-vadodara-1-to-3-years-200326504728
Product Analyst,Product Analyst,A1apps,0-3 yrs,Gurugram,"Product Analyst, Usage, Google Analytics, Business Analyst, Data Analyst, Management, SQL, Python",3+ weeks ago,https://www.naukri.com/job-listings-product-analyst-a1apps-gurugram-0-to-3-years-100325501092
Product Analyst,Product Analyst,Across Assist,0-3 yrs,Gurugram,"Analytical skills, Product Analyst, Backend, Data analysis, Assurance, Diversity and Inclusion, product life cycle, Market research",3+ weeks ago,https://www.naukri.com/job-listings-product-analyst-across-assist-private-limited-gurugram-0-to-3-years-061124500732
